{
  "$schema": "http://json-schema.org/draft-07/schema#",
  "title": "readings",
  "type": "object",
  "properties": {
    "clouds": {
      "type": "object",
      "properties": {
        "condition": {
          "type": "string"
        },
        "correctedDelta": {
          "type": "number"
        },
        "coverPercent": {
          "type": "number"
        },
        "description": {
          "type": "string"
        },
        "humidity": {
          "type": "number"
        },
        "humiditySource": {
          "type": "string"
        },
        "status": {
          "type": "string"
        },
        "temperatureDelta": {
          "type": "number"
        }
      },
      "required": [
        "status"
      ],
      "additionalProperties": false
    },
    "dataAgeMs": {
      "type": "number"
    },
    "dataStale": {
      "type": "boolean"
    },
    "environment": {
      "type": "object",
      "properties": {
        "ageMs": {
          "type": "number"
        },
        "dewpoint": {
          "type": "number"
        },
        "humidity": {
          "type": "number"
        },
        "pressure": {
          "type": "number"
        },
        "status": {
          "type": "string"
        },
        "temperature": {
          "type": "number"
        }
      },
      "required": [
        "status"
      ],
      "additionalProperties": false
    },
    "gps": {
      "type": "object",
      "properties": {
        "ageMs": {
          "type": "number"
        },
        "altitude": {
          "type": "number"
        },
        "fix": {
          "type": "boolean"
        },
        "hdop": {
          "type": "number"
        },
        "latitude": {
          "type": "number"
        },
        "longitude": {
          "type": "number"
        },
        "satellites": {
          "type": "number"
        },
        "status": {
          "type": "string"
        }
      },
      "required": [
        "status"
      ],
      "additionalProperties": false
    },
    "infrared": {
      "type": "object",
      "properties": {
        "ageMs": {
          "type": "number"
        },
        "ambientTemperature": {
          "type": "number"
        },
        "skyTemperature": {
          "type": "number"
        },
        "status": {
          "type": "string"
        }
      },
      "required": [
        "status"
      ],
      "additionalProperties": false
    },
    "light": {
      "type": "object",
      "properties": {
        "ageMs": {
          "type": "number"
        },
        "full": {
          "type": "number"
        },
        "gain": {
          "type": "string"
        },
        "gainFactor": {
          "type": "number"
        },
        "infrared": {
          "type": "number"
        },
        "integrationMs": {
          "type": "number"
        },
        "lux": {
          "type": "number"
        },
        "nightMode": {
          "type": "boolean"
        },
        "saturated": {
          "type": "boolean"
        },
        "status": {
          "type": "string"
        },
        "visible": {
          "type": "number"
        }
      },
      "required": [
        "status"
      ],
      "additionalProperties": false
    },
    "rain": {
      "type": "object",
      "properties": {
        "ageMs": {
          "type": "number"
        },
        "emitterSaturated": {
          "type": "boolean"
        },
        "eventAccumulation": {
          "type": "number"
        },
        "intensity": {
          "type": "number"
        },
        "lensFault": {
          "type": "boolean"
        },
        "raining": {
          "type": "boolean"
        },
        "rainingNow": {
          "type": "boolean"
        },
        "sensorEventAccumulation": {
          "type": "number"
        },
        "status": {
          "type": "string"
        },
        "totalAccumulation": {
          "type": "number"
        },
        "clearInSeconds": {
          "type": "integer",
          "minimum": 0,
          "description": "Seconds until the rain hold releases; present only while rain has stopped but the clear delay holds it (spec 025)."
        }
      },
      "required": [
        "status"
      ],
      "additionalProperties": false
    },
    "safety": {
      "type": "object",
      "properties": {
        "alpacaEnabled": {
          "type": "boolean"
        },
        "changedAgeMs": {
          "type": "number"
        },
        "evaluatedAgeMs": {
          "type": "number"
        },
        "rawSafe": {
          "type": "boolean"
        },
        "reasonFlags": {
          "type": "number"
        },
        "reasons": {
          "type": "array",
          "items": {
            "type": "string"
          }
        },
        "rulesNotInEffect": {
          "type": "array",
          "items": {
            "type": "string"
          }
        },
        "safe": {
          "type": "boolean"
        },
        "secondsUntilSafe": {
          "type": "number"
        }
      },
      "required": [
        "alpacaEnabled",
        "changedAgeMs",
        "evaluatedAgeMs",
        "rawSafe",
        "reasonFlags",
        "reasons",
        "rulesNotInEffect",
        "safe",
        "secondsUntilSafe"
      ],
      "additionalProperties": false
    },
    "sky": {
      "type": "object",
      "properties": {
        "averagingWindowSeconds": {
          "type": "number"
        },
        "bortle": {
          "type": "number"
        },
        "calibrated": {
          "type": "boolean"
        },
        "description": {
          "type": "string"
        },
        "nelm": {
          "type": "number"
        },
        "rawSqm": {
          "type": "number"
        },
        "source": {
          "type": "string",
          "enum": [
            "sqm",
            "sqml"
          ]
        },
        "sqm": {
          "type": "number"
        },
        "status": {
          "type": "string"
        }
      },
      "required": [
        "status"
      ],
      "additionalProperties": false
    },
    "skySensors": {
      "type": "object",
      "properties": {
        "deltaSqm": {
          "type": "number"
        },
        "sqm": {
          "type": "object",
          "properties": {
            "ageMs": {
              "type": "number"
            },
            "averagingWindowSeconds": {
              "type": "number"
            },
            "bortle": {
              "type": "number"
            },
            "calibrated": {
              "type": "boolean"
            },
            "description": {
              "type": "string"
            },
            "gain": {
              "type": "string"
            },
            "integrationMs": {
              "type": "number"
            },
            "lux": {
              "type": "number"
            },
            "nelm": {
              "type": "number"
            },
            "nightMode": {
              "type": "boolean"
            },
            "rawSqm": {
              "type": "number"
            },
            "saturated": {
              "type": "boolean"
            },
            "sqm": {
              "type": "number"
            },
            "status": {
              "type": "string"
            }
          },
          "required": [
            "status"
          ],
          "additionalProperties": false
        },
        "sqml": {
          "type": "object",
          "properties": {
            "ageMs": {
              "type": "number"
            },
            "averagingWindowSeconds": {
              "type": "number"
            },
            "bortle": {
              "type": "number"
            },
            "calibrated": {
              "type": "boolean"
            },
            "description": {
              "type": "string"
            },
            "gain": {
              "type": "string"
            },
            "integrationMs": {
              "type": "number"
            },
            "lux": {
              "type": "number"
            },
            "nelm": {
              "type": "number"
            },
            "nightMode": {
              "type": "boolean"
            },
            "rawSqm": {
              "type": "number"
            },
            "saturated": {
              "type": "boolean"
            },
            "sqm": {
              "type": "number"
            },
            "status": {
              "type": "string"
            }
          },
          "required": [
            "status"
          ],
          "additionalProperties": false
        }
      },
      "additionalProperties": false
    },
    "timeValid": {
      "type": "boolean"
    },
    "timestamp": {
      "type": "number"
    },
    "wind": {
      "type": "object",
      "properties": {
        "ageMs": {
          "type": "number"
        },
        "direction": {
          "type": "number"
        },
        "gust": {
          "type": "number"
        },
        "speed": {
          "type": "number"
        },
        "status": {
          "type": "string"
        },
        "vaneFault": {
          "type": "boolean"
        }
      },
      "required": [
        "status"
      ],
      "additionalProperties": false
    },
    "battery": {
      "type": "object",
      "properties": {
        "present": {
          "type": "boolean"
        },
        "status": {
          "type": "string"
        },
        "ageMs": {
          "type": "number"
        },
        "estimating": {
          "type": "boolean"
        },
        "percent": {
          "type": [
            "number",
            "null"
          ]
        },
        "voltage": {
          "type": "number"
        },
        "ratePercentPerHour": {
          "type": [
            "number",
            "null"
          ]
        },
        "state": {
          "type": [
            "string",
            "null"
          ],
          "enum": [
            "discharging",
            "charging",
            "charged",
            "fault",
            "no-battery",
            null
          ]
        },
        "usbPower": {
          "type": [
            "boolean",
            "null"
          ]
        },
        "fault": {
          "type": [
            "string",
            "null"
          ],
          "enum": [
            "temperature",
            null
          ]
        },
        "timeToEmptyMinutes": {
          "type": [
            "number",
            "null"
          ]
        },
        "timeToFullMinutes": {
          "type": [
            "number",
            "null"
          ]
        },
        "powerSaving": {
          "type": "boolean"
        }
      },
      "required": [
        "present"
      ],
      "additionalProperties": false
    }
  },
  "required": [
    "clouds",
    "dataAgeMs",
    "dataStale",
    "environment",
    "infrared",
    "light",
    "safety",
    "sky",
    "timeValid",
    "timestamp"
  ],
  "additionalProperties": false
}
